{
  "$schema": "http://json-schema.org/draft-07/schema#",
  "title": "Grantha Envelope Schema",
  "description": "Top-level envelope for a grantha. Carries identity, classification, and an ordered list of edition stubs. One file per grantha.",
  "type": "object",
  "properties": {
    "kind": {
      "type": "string",
      "const": "grantha-envelope",
      "description": "Explicit file-type discriminator. Must be 'grantha-envelope' for top-level grantha envelopes."
    },
    "schema_version": {
      "type": "string",
      "pattern": "^\\d+\\.\\d+\\.\\d+$",
      "description": "Version of this schema in semver format (MAJOR.MINOR.PATCH). Major version changes indicate breaking schema changes."
    },
    "grantha_id": {
      "type": "string",
      "pattern": "^[a-z0-9-]+$"
    },
    "canonical_title": { "type": "string" },
    "text_type": {
      "type": "string",
      "enum": ["upanishad", "smriti", "sutra", "purana", "stotra", "prakarana", "brahma-sutra-bhashya", "gita-bhashya", "gita", "ramayana", "other"]
    },
    "language": {
      "type": "string",
      "enum": ["sanskrit", "english"]
    },
    "aliases": {
      "type": "array",
      "items": {
        "type": "object",
        "properties": {
          "alias": { "type": "string" },
          "scope": { "type": "string", "enum": ["full_text", "abbreviation"] }
        },
        "required": ["alias", "scope"],
        "additionalProperties": false
      }
    },
    "editions": {
      "type": "array",
      "minItems": 1,
      "items": { "$ref": "#/definitions/edition_stub" }
    }
  },
  "required": [
    "kind",
    "schema_version",
    "grantha_id",
    "canonical_title",
    "text_type",
    "language",
    "editions"
  ],
  "additionalProperties": false,

  "definitions": {
    "edition_stub": {
      "type": "object",
      "description": "Lightweight descriptor for one edition. Carried in the grantha envelope's editions array. A .json suffix in path means single file; no suffix means directory.",
      "properties": {
        "edition_id": {
          "type": "string",
          "pattern": "^[a-z0-9-]+$"
        },
        "path": {
          "type": "string",
          "description": "Relative path to the edition file or directory. A .json suffix = single file; no suffix = directory containing an envelope + part files."
        },
        "commentator": {
          "type": "object",
          "description": "Primary commentator for this edition.",
          "properties": {
            "devanagari": { "type": "string" },
            "roman": { "type": "string" }
          },
          "required": ["devanagari"],
          "additionalProperties": false
        },
        "commentary_title": { "type": "string" },
        "commentary_of": {
          "type": "string",
          "pattern": "^[a-z0-9-]+$",
          "description": "Parent commentary_id this edition comments on. Omitted for direct commentaries on the mula."
        },
        "isDefault": {
          "type": "boolean",
          "description": "Mark exactly one edition stub as default in a multi-edition grantha. Moot for single-edition granthas."
        }
      },
      "required": ["edition_id", "path", "commentator", "commentary_title"],
      "additionalProperties": false
    },

    "edition_sub_envelope": {
      "type": "object",
      "description": "Shape of the envelope.json that lives inside an edition directory for multi-part editions. Validated by the Python validator using this definition.",
      "properties": {
        "kind": {
          "type": "string",
          "const": "edition-sub-envelope",
          "description": "Explicit file-type discriminator. Must be 'edition-sub-envelope' for edition-directory envelopes."
        },
        "schema_version": {
          "type": "string",
          "pattern": "^\\d+\\.\\d+\\.\\d+$"
        },
        "edition_id": {
          "type": "string",
          "pattern": "^[a-z0-9-]+$"
        },
        "grantha_id": {
          "type": "string",
          "pattern": "^[a-z0-9-]+$"
        },
        "structure_levels": {
          "type": "array",
          "items": { "$ref": "#/definitions/structure_level" }
        },
        "parts": {
          "description": "Ordered list of content parts for this edition. Each entry names the file and records the ref of the first main passage in that file, so the runtime knows which structural group (e.g. Adhyaya) the part belongs to without loading the content file.",
          "type": "array",
          "minItems": 1,
          "items": {
            "type": "object",
            "properties": {
              "file": {
                "type": "string",
                "pattern": "^part[0-9]+\\.json$",
                "description": "Filename of the part content file."
              },
              "first_ref": {
                "type": "string",
                "description": "Ref of the first main passage in this part file (e.g. '3.1.1'). The top-level segment (split on '.') identifies the structural group this part belongs to."
              }
            },
            "required": ["file", "first_ref"],
            "additionalProperties": false
          }
        },
        "metadata": { "type": "object" },
        "aliases": { "type": "array", "items": { "type": "string" } },
        "variants_available": { "type": "array", "items": { "type": "string" } },
        "tags": { "type": "array", "items": { "type": "string" } }
      },
      "required": [
        "kind",
        "schema_version",
        "edition_id",
        "grantha_id",
        "structure_levels",
        "parts"
      ],
      "additionalProperties": false
    },

    "structure_level": {
      "type": "object",
      "description": "One level in the hierarchical structure of a grantha (e.g. Adhyaya, Brahmana, Mantra). Canonical definition lives here; grantha.schema.json references this.",
      "properties": {
        "key": { "type": "string" },
        "scriptNames": {
          "type": "object",
          "properties": {
            "devanagari": { "type": "string" },
            "roman": { "type": "string" }
          },
          "required": ["devanagari"]
        },
        "children": {
          "oneOf": [
            {
              "type": "array",
              "description": "Array of child structure levels (preferred format)",
              "items": { "$ref": "#/definitions/structure_level" }
            },
            {
              "description": "Single child structure level (legacy format - will be converted to array)",
              "$ref": "#/definitions/structure_level"
            }
          ]
        }
      },
      "required": ["key", "scriptNames"]
    }
  }
}
