{
  "kind": "grantha-envelope",
  "schema_version": "1.4.0",
  "grantha_id": "isavasya-upanishad",
  "canonical_title": "ईशावास्योपनिषत्",
  "text_type": "upanishad",
  "language": "sanskrit",
  "editions": [
    {
      "edition_id": "isavasya-upanishad-vedantadesika",
      "path": "upanishads/isavasya/isavasya-upanishad-vedantadesika",
      "commentary_title": "ईशावास्योपनिषद्भाष्यम्",
      "commentator": {
        "devanagari": "श्रीमद्वेदान्ताचार्यः",
        "roman": "śrīmadvēdāntācāryaḥ"
      },
      "isDefault": true
    },
    {
      "edition_id": "isavasya-upanishad-sankara-bhashya",
      "path": "upanishads/isavasya/isavasya-upanishad-sankara-bhashya",
      "commentary_title": "ईशावास्योपनिषद्भाष्यम्",
      "commentator": {
        "devanagari": "श्रीमच्छङ्करभगवत्पूज्यपादः",
        "roman": "śrīmacchaṅkarabhagavatpūjyapādaḥ"
      }
    },
    {
      "edition_id": "isavasya-upanishad-srivatsanarayana",
      "path": "upanishads/isavasya/isavasya-upanishad-srivatsanarayana",
      "commentary_title": "प्रकाशिका",
      "commentator": {
        "devanagari": "श्रीवत्सनारायणमुनीन्द्रः",
        "roman": "śrīvatsanārāyaṇamunīndraḥ"
      }
    },
    {
      "edition_id": "isavasya-upanishad-vedantadesika-varadachari",
      "path": "upanishads/isavasya/isavasya-upanishad-vedantadesika-varadachari",
      "commentary_title": "ईशावास्योपनिषद्भाष्यम्",
      "commentator": {
        "devanagari": "श्रीमद्वेदान्ताचार्यः",
        "roman": "śrīmadvēdāntācāryaḥ"
      }
    }
  ]
}